{
  "schema_version": "1",
  "artifact_type": "research_packet",
  "research_id": "research_019fa935-6af9-7258-bb1d-b8a6112b3111",
  "status": "DRAFT",
  "core_sdlc_trace_ref": "NOT_ISSUED_DOCUMENTATION_ONLY",
  "subject": {
    "subject_schema": "research-subject/v1",
    "project_id": "prj_019fa935-6afc-7740-9472-9fe9572854f2",
    "work_item_id": "work_019fa935-6afd-7b05-959f-b015944692a0",
    "repository_id": "repo_019fa935-6afe-7e40-b5a9-f262e42809d9",
    "repository_uri_digest": "sha256:34bbe7c66a9ab7de14fc18afa6b045922ad616b16d1c49e307f90c34137247b4",
    "base_revision": "4baad4a67843b02d5970f442fb54aed8d6525dda",
    "question_digest": "sha256:749c5ac27fb2e546bc4fa321b231a745fa85a123fe2783482587143cd5062ef6",
    "scope_digest": "sha256:a70ffb9d363332245df9234381d4c716f6941d36f53889c9690ea1a5740ffde2",
    "source_manifest_digest": "sha256:38cbd5ba8cdc6b8b843f2ec44eefade3ac1af9d75cf438d401d4872541c46bce",
    "research_prompt_digest": "sha256:5262d26b9839632504a74b8ad44ce1216a78bc5c2aec35116d3907b2d8f93856",
    "observed_at": "2026-07-28T14:51:21Z"
  },
  "question": "Which APOSD, ciembor agent-rule, and Matt Pocock codebase-design ideas should Ranex reject, evaluate, or later adapt without creating parallel authority or unsupported effectiveness claims?",
  "scope": [
    "Local APOSD PDF byte identity and public-safe provenance limits",
    "ciembor/agent-rules-books at commit 9c8763613514e4047d75c089533e09bc4b493c28",
    "mattpocock/skills architecture-related subset at commit 2ab958093e83e0ec752e6c1c5932da465bf23e0c",
    "Three user-provided GPT advisory attachments identified by byte digest",
    "Current Ranex authority, design, practice-profile, review, experiment, gate, and learning contracts",
    "A read-only comparative evaluation proposal"
  ],
  "method": [
    "Freeze each local source by SHA-256 and each Git source by immutable commit plus inspected-file SHA-256 values.",
    "Read the requested materials and their relevant transitive workflow, license, provenance, criticism, report, test, and integration files.",
    "Separate source observations, self-reported claims, inferences, proposals, owner decisions, runtime enactment, and effectiveness.",
    "Compare every candidate mechanism with existing Ranex ownership and authority contracts.",
    "Use isolated architecture-fit, evidence, and adversarial review roles.",
    "Seek advisory HY3 and DeepSeek challenge and record that unqualified model consultation cannot become gate authority.",
    "Predeclare a paired, read-only baseline-versus-treatment evaluation rather than activate the candidate.",
    "Compute question_digest, scope_digest, source_manifest_digest, and research_prompt_digest as RFC 8785 plus SHA-256 over the question string, scope array, source_manifest array, and {question, scope, method} object respectively."
  ],
  "source_manifest": [
    {
      "path_or_uri": "local-research://ENGREF-APOSD-LOCAL-PDF-48CEE0A4",
      "revision": "LOCAL_BYTES_2026-07-28",
      "digest": "sha256:48cee0a4a0dfeeea6617b71252bf989df8a616ca389b9fc9e1bb5b1627441d61",
      "source_type": "LOCAL_FULL_TEXT_REPRESENTATION",
      "authority": "REGISTERED_DEFINITION_LAYER_PRACTICE_REFERENCE_NOASSERTION",
      "observed_at": "2026-07-28T13:00:42Z",
      "freshness": "IMMUTABLE_BYTE_DIGEST"
    },
    {
      "path_or_uri": "https://github.com/ciembor/agent-rules-books/tree/9c8763613514e4047d75c089533e09bc4b493c28",
      "revision": "9c8763613514e4047d75c089533e09bc4b493c28",
      "digest": "sha256:2c2f49d869eaae48802e792955cfb0cef3733688286f533875a936f6d46c4386",
      "source_type": "THIRD_PARTY_DERIVATIVE_RULEPACK_INSPECTED_SUBSET",
      "authority": "RESEARCH_PRIOR_ART_MIT_DECLARED",
      "observed_at": "2026-07-28T14:51:21Z",
      "freshness": "PINNED_IMMUTABLE_COMMIT"
    },
    {
      "path_or_uri": "https://github.com/mattpocock/skills/tree/2ab958093e83e0ec752e6c1c5932da465bf23e0c",
      "revision": "2ab958093e83e0ec752e6c1c5932da465bf23e0c",
      "digest": "sha256:087287ad1faf0b4c304ee43aafe9fd7355322c9c6f087b1e2a1bb5833796d0fa",
      "source_type": "THIRD_PARTY_WORKFLOW_PRIOR_ART_INSPECTED_SUBSET",
      "authority": "RESEARCH_PRIOR_ART_MIT_DECLARED",
      "observed_at": "2026-07-28T14:51:21Z",
      "freshness": "PINNED_IMMUTABLE_COMMIT"
    },
    {
      "path_or_uri": "attachment-digest://GPT-ANALYSIS-BOOK-TO-CONTROLS-001",
      "revision": "USER_ATTACHMENT_BYTES",
      "digest": "sha256:bac38eef449e8a250033b85ff680dd516da7644c6e69e4fc0a9c8e119eedb6c5",
      "source_type": "USER_PROVIDED_ADVISORY_MODEL_OUTPUT",
      "authority": "SECONDARY_ANALYSIS_NOASSERTION",
      "observed_at": "2026-07-28T13:18:25Z",
      "freshness": "IMMUTABLE_BYTE_DIGEST"
    },
    {
      "path_or_uri": "attachment-digest://GPT-ANALYSIS-CONTROL-ARCHITECTURE-002",
      "revision": "USER_ATTACHMENT_BYTES",
      "digest": "sha256:f08b54b0425fbead4a5017d5086017bebf1369edfb3f3c9fda21a18edc5f59cd",
      "source_type": "USER_PROVIDED_ADVISORY_MODEL_OUTPUT",
      "authority": "SECONDARY_ANALYSIS_NOASSERTION",
      "observed_at": "2026-07-28T14:11:45Z",
      "freshness": "IMMUTABLE_BYTE_DIGEST"
    },
    {
      "path_or_uri": "attachment-digest://GPT-ANALYSIS-MATT-SKILLS-003",
      "revision": "USER_ATTACHMENT_BYTES",
      "digest": "sha256:71c6b9ffd505aa5f8ca6fbd1cbd209194c9499536b3f786ee6cf843666282524",
      "source_type": "USER_PROVIDED_ADVISORY_MODEL_OUTPUT",
      "authority": "SECONDARY_ANALYSIS_NOASSERTION",
      "observed_at": "2026-07-28T14:15:42Z",
      "freshness": "IMMUTABLE_BYTE_DIGEST"
    }
  ],
  "claims": [
    {
      "claim_id": "CLAIM-APOSD-SOURCE-001",
      "statement": "The local APOSD representation is frozen by byte digest and its front matter identifies First Edition v1.01, November 2018; official-file authenticity, acquisition, custody, conversion fidelity, permitted model use, and redistribution permission remain unresolved.",
      "epistemic_status": "FACT",
      "evidence_refs": [
        "local-research://ENGREF-APOSD-LOCAL-PDF-48CEE0A4",
        "docs/research/aposd-agent-rules-codebase-design-assessment-2026-07-28.md#31-local-aposd-representation"
      ],
      "confidence": "HIGH_FOR_BYTES_LOW_FOR_PROVENANCE",
      "limitations": [
        "The available PDF inspection did not authenticate embedded metadata against a publisher source."
      ]
    },
    {
      "claim_id": "CLAIM-CIEMBOR-LINEAGE-002",
      "statement": "The ciembor repository is one MIT-declared derivative rule-pack lineage whose representations and generated traceability do not independently establish APOSD fidelity.",
      "epistemic_status": "FACT",
      "evidence_refs": [
        "https://github.com/ciembor/agent-rules-books/tree/9c8763613514e4047d75c089533e09bc4b493c28",
        "docs/research/aposd-agent-rules-codebase-design-assessment-2026-07-28.md#32-ciemboragent-rules-books"
      ],
      "confidence": "HIGH",
      "limitations": [
        "No private authoring, review, or legal evidence was inspected."
      ]
    },
    {
      "claim_id": "CLAIM-CIEMBOR-EVAL-003",
      "statement": "The ciembor repository reports one early qualitative comparison; it does not provide a general benchmark for architecture quality or Ranex suitability.",
      "epistemic_status": "FACT",
      "evidence_refs": [
        "https://github.com/ciembor/agent-rules-books/blob/9c8763613514e4047d75c089533e09bc4b493c28/README.md",
        "https://github.com/ciembor/agent-rules-books/blob/9c8763613514e4047d75c089533e09bc4b493c28/docs/CRITICISM.md"
      ],
      "confidence": "HIGH_FOR_PUBLIC_SELF_REPORT",
      "limitations": [
        "The underlying run, grader calibration, prompts, and independent replication were not available."
      ]
    },
    {
      "claim_id": "CLAIM-MATT-WORKFLOW-004",
      "statement": "At the pinned commit, Matt's skill pair implements user-invoked hotspot discovery, candidate selection, qualitative module questions, and optional alternative-interface generation.",
      "epistemic_status": "FACT",
      "evidence_refs": [
        "https://github.com/mattpocock/skills/blob/2ab958093e83e0ec752e6c1c5932da465bf23e0c/skills/engineering/improve-codebase-architecture/SKILL.md",
        "https://github.com/mattpocock/skills/blob/2ab958093e83e0ec752e6c1c5932da465bf23e0c/skills/engineering/codebase-design/SKILL.md",
        "https://github.com/mattpocock/skills/blob/2ab958093e83e0ec752e6c1c5932da465bf23e0c/skills/engineering/codebase-design/DESIGN-IT-TWICE.md"
      ],
      "confidence": "HIGH",
      "limitations": [
        "Source presence proves prescribed behavior, not actual use, fidelity, maturity, or outcomes."
      ]
    },
    {
      "claim_id": "CLAIM-MATT-ASSURANCE-005",
      "statement": "The inspected public tree contains no checked-in evaluation harness or package test/eval command specific to this skill pair.",
      "epistemic_status": "FACT",
      "evidence_refs": [
        "https://github.com/mattpocock/skills/blob/2ab958093e83e0ec752e6c1c5932da465bf23e0c/package.json",
        "docs/research/aposd-agent-rules-codebase-design-assessment-2026-07-28.md#33-matt-pocock-architecture-skills"
      ],
      "confidence": "HIGH_FOR_INSPECTED_PUBLIC_TREE",
      "limitations": [
        "This does not establish that no private or external evaluation exists."
      ]
    },
    {
      "claim_id": "CLAIM-DIRECT-USE-006",
      "statement": "Direct installation or wholesale copying would introduce conflicting vocabulary, unsafe absolutes, transitive tools, network-dependent reports, authority mutation, and test-retirement risks.",
      "epistemic_status": "INFERENCE",
      "evidence_refs": [
        "docs/research/aposd-agent-rules-codebase-design-assessment-2026-07-28.md#33-matt-pocock-architecture-skills",
        "docs/research/aposd-agent-rules-codebase-design-assessment-2026-07-28.md#6-threat-and-failure-analysis"
      ],
      "confidence": "HIGH",
      "limitations": [